Difficulty,Title,Frequency,Acceptance Rate,Link,Topics
EASY,Two Sum,100.0,0.5507379508561278,https://leetcode.com/problems/two-sum,"Array, Hash Table"
EASY,Create Hello World Function,80.0,0.8182503818859103,https://leetcode.com/problems/create-hello-world-function,
EASY,Merge Strings Alternately,74.7,0.8181647377753473,https://leetcode.com/problems/merge-strings-alternately,"Two Pointers, String"
EASY,Recyclable and Low Fat Products,74.7,0.8937634256619811,https://leetcode.com/problems/recyclable-and-low-fat-products,Database
EASY,Merge Sorted Array,70.2,0.5225683871742244,https://leetcode.com/problems/merge-sorted-array,"Array, Two Pointers, Sorting"
EASY,Longest Common Prefix,66.1,0.44887898798329745,https://leetcode.com/problems/longest-common-prefix,"String, Trie"
MEDIUM,Add Two Numbers,64.4,0.4543965080767522,https://leetcode.com/problems/add-two-numbers,"Linked List, Math, Recursion"
EASY,Remove Duplicates from Sorted Array,64.4,0.5945074620755648,https://leetcode.com/problems/remove-duplicates-from-sorted-array,"Array, Two Pointers"
HARD,Median of Two Sorted Arrays,62.7,0.429393695737594,https://leetcode.com/problems/median-of-two-sorted-arrays,"Array, Binary Search, Divide and Conquer"
HARD,Trapping Rain Water,62.7,0.6428753017089767,https://leetcode.com/problems/trapping-rain-water,"Array, Two Pointers, Dynamic Programming, Stack, Monotonic Stack"
EASY,Climbing Stairs,62.7,0.5334305798456781,https://leetcode.com/problems/climbing-stairs,"Math, Dynamic Programming, Memoization"
MEDIUM,Longest Substring Without Repeating Characters,60.8,0.3632668601107121,https://leetcode.com/problems/longest-substring-without-repeating-characters,"Hash Table, String, Sliding Window"
EASY,Add Two Integers,60.8,0.8811604823847654,https://leetcode.com/problems/add-two-integers,Math
EASY,Pascal's Triangle,60.8,0.7642548455060169,https://leetcode.com/problems/pascals-triangle,"Array, Dynamic Programming"
MEDIUM,3Sum,58.7,0.36423060075594826,https://leetcode.com/problems/3sum,"Array, Two Pointers, Sorting"
MEDIUM,Maximal Square,58.7,0.4822792020688925,https://leetcode.com/problems/maximal-square,"Array, Dynamic Programming, Matrix"
EASY,Palindrome Number,58.7,0.586536002116664,https://leetcode.com/problems/palindrome-number,Math
MEDIUM,Design a Number Container System,58.7,0.5816330728095433,https://leetcode.com/problems/design-a-number-container-system,"Hash Table, Design, Heap (Priority Queue), Ordered Set"
EASY,Single Number,58.7,0.7533125320290354,https://leetcode.com/problems/single-number,"Array, Bit Manipulation"
MEDIUM,Longest Palindromic Substring,56.3,0.35298351728815647,https://leetcode.com/problems/longest-palindromic-substring,"Two Pointers, String, Dynamic Programming"
EASY,Roman to Integer,53.6,0.6415380784258702,https://leetcode.com/problems/roman-to-integer,"Hash Table, Math, String"
MEDIUM,Top K Frequent Elements,53.6,0.6408009414896952,https://leetcode.com/problems/top-k-frequent-elements,"Array, Hash Table, Divide and Conquer, Sorting, Heap (Priority Queue), Bucket Sort, Counting, Quickselect"
MEDIUM,Longest Consecutive Sequence,53.6,0.47190664042974156,https://leetcode.com/problems/longest-consecutive-sequence,"Array, Hash Table, Union Find"
EASY,Merge Two Sorted Lists,53.6,0.66289514052412,https://leetcode.com/problems/merge-two-sorted-lists,"Linked List, Recursion"
MEDIUM,Count Number of Bad Pairs,53.6,0.5448559854835412,https://leetcode.com/problems/count-number-of-bad-pairs,"Array, Hash Table, Math, Counting"
MEDIUM,Maximum Subarray,53.6,0.5173369560272215,https://leetcode.com/problems/maximum-subarray,"Array, Divide and Conquer, Dynamic Programming"
MEDIUM,LRU Cache,50.5,0.4443099993738651,https://leetcode.com/problems/lru-cache,"Hash Table, Linked List, Design, Doubly-Linked List"
MEDIUM,Search in Rotated Sorted Array,50.5,0.4232396700246752,https://leetcode.com/problems/search-in-rotated-sorted-array,"Array, Binary Search"
HARD,Finding MK Average,50.5,0.3795608908545254,https://leetcode.com/problems/finding-mk-average,"Design, Queue, Heap (Priority Queue), Data Stream, Ordered Set"
HARD,Largest Rectangle in Histogram,50.5,0.46599430727940705,https://leetcode.com/problems/largest-rectangle-in-histogram,"Array, Stack, Monotonic Stack"
MEDIUM,Generate Parentheses,50.5,0.7652984707443845,https://leetcode.com/problems/generate-parentheses,"String, Dynamic Programming, Backtracking"
EASY,Contains Duplicate II,50.5,0.48127754997240196,https://leetcode.com/problems/contains-duplicate-ii,"Array, Hash Table, Sliding Window"
HARD,Sliding Window Maximum,50.5,0.4724660010659033,https://leetcode.com/problems/sliding-window-maximum,"Array, Queue, Sliding Window, Heap (Priority Queue), Monotonic Queue"
EASY,Create a DataFrame from List,50.5,0.8143275733177517,https://leetcode.com/problems/create-a-dataframe-from-list,
HARD,N-Queens,50.5,0.7166910476136805,https://leetcode.com/problems/n-queens,"Array, Backtracking"
MEDIUM,Rotate Image,50.5,0.7717075756878434,https://leetcode.com/problems/rotate-image,"Array, Math, Matrix"
MEDIUM,Zigzag Conversion,50.5,0.5079123792658975,https://leetcode.com/problems/zigzag-conversion,String
EASY,Search Insert Position,46.9,0.48338374370417647,https://leetcode.com/problems/search-insert-position,"Array, Binary Search"
MEDIUM,Spiral Matrix,46.9,0.5293292273196886,https://leetcode.com/problems/spiral-matrix,"Array, Matrix, Simulation"
EASY,Majority Element,46.9,0.6549768718528167,https://leetcode.com/problems/majority-element,"Array, Hash Table, Divide and Conquer, Sorting, Counting"
MEDIUM,Single Element in a Sorted Array,46.9,0.5915651550824035,https://leetcode.com/problems/single-element-in-a-sorted-array,"Array, Binary Search"
EASY,Valid Anagram,46.9,0.6615041387591161,https://leetcode.com/problems/valid-anagram,"Hash Table, String, Sorting"
MEDIUM,Reverse Words in a String,46.9,0.5006636000457989,https://leetcode.com/problems/reverse-words-in-a-string,"Two Pointers, String"
MEDIUM,Container With Most Water,46.9,0.5717349107192083,https://leetcode.com/problems/container-with-most-water,"Array, Two Pointers, Greedy"
MEDIUM,Rotate Array,46.9,0.4246122078866147,https://leetcode.com/problems/rotate-array,"Array, Math, Two Pointers"
EASY,Remove Element,46.9,0.594380162102366,https://leetcode.com/problems/remove-element,"Array, Two Pointers"
EASY,Special Array I,42.4,0.8211341941120445,https://leetcode.com/problems/special-array-i,Array
EASY,Article Views I,42.4,0.7712504128034772,https://leetcode.com/problems/article-views-i,Database
EASY,Clear Digits,42.4,0.8275591952999822,https://leetcode.com/problems/clear-digits,"String, Stack, Simulation"
MEDIUM,Decode String,42.4,0.6068660634109276,https://leetcode.com/problems/decode-string,"String, Stack, Recursion"
HARD,Candy,42.4,0.4438421040357648,https://leetcode.com/problems/candy,"Array, Greedy"
MEDIUM,Merge Intervals,42.4,0.4880649271096516,https://leetcode.com/problems/merge-intervals,"Array, Sorting"
MEDIUM,Find the Number of Distinct Colors Among the Balls,42.4,0.5430930089798767,https://leetcode.com/problems/find-the-number-of-distinct-colors-among-the-balls,"Array, Hash Table, Simulation"
MEDIUM,Subsets,42.4,0.8025894997461674,https://leetcode.com/problems/subsets,"Array, Backtracking, Bit Manipulation"
MEDIUM,Remove All Occurrences of a Substring,42.4,0.7798068651327348,https://leetcode.com/problems/remove-all-occurrences-of-a-substring,"String, Stack, Simulation"
MEDIUM,Next Permutation,42.4,0.423240509456743,https://leetcode.com/problems/next-permutation,"Array, Two Pointers"
EASY,Max Consecutive Ones,42.4,0.6177042105813005,https://leetcode.com/problems/max-consecutive-ones,Array
MEDIUM,Reverse Integer,42.4,0.2986431235283417,https://leetcode.com/problems/reverse-integer,Math
MEDIUM,Kth Largest Element in an Array,36.7,0.676204131851813,https://leetcode.com/problems/kth-largest-element-in-an-array,"Array, Divide and Conquer, Sorting, Heap (Priority Queue), Quickselect"
MEDIUM,"Pow(x, n)",36.7,0.3647742538790063,https://leetcode.com/problems/powx-n,"Math, Recursion"
HARD,Russian Doll Envelopes,36.7,0.3719137919994145,https://leetcode.com/problems/russian-doll-envelopes,"Array, Binary Search, Dynamic Programming, Sorting"
MEDIUM,Coin Change,36.7,0.4581322419962037,https://leetcode.com/problems/coin-change,"Array, Dynamic Programming, Breadth-First Search"
EASY,Valid Palindrome II,36.7,0.4247643132821805,https://leetcode.com/problems/valid-palindrome-ii,"Two Pointers, String, Greedy"
EASY,Valid Parentheses,36.7,0.41845176476558377,https://leetcode.com/problems/valid-parentheses,"String, Stack"
MEDIUM,Palindrome Partitioning,36.7,0.7138387050735545,https://leetcode.com/problems/palindrome-partitioning,"String, Dynamic Programming, Backtracking"
MEDIUM,Number of Islands,36.7,0.6158088481082719,https://leetcode.com/problems/number-of-islands,"Array, Depth-First Search, Breadth-First Search, Union Find, Matrix"
MEDIUM,Tuple with Same Product,36.7,0.7024833515722166,https://leetcode.com/problems/tuple-with-same-product,"Array, Hash Table, Counting"
EASY,Big Countries,36.7,0.6820234299281646,https://leetcode.com/problems/big-countries,Database
MEDIUM,Group Anagrams,36.7,0.7033699077307562,https://leetcode.com/problems/group-anagrams,"Array, Hash Table, String, Sorting"
EASY,Move Zeroes,36.7,0.6254444097752963,https://leetcode.com/problems/move-zeroes,"Array, Two Pointers"
MEDIUM,Product of Array Except Self,36.7,0.6738352589943034,https://leetcode.com/problems/product-of-array-except-self,"Array, Prefix Sum"
EASY,Average Time of Process per Machine,36.7,0.6887760578951257,https://leetcode.com/problems/average-time-of-process-per-machine,Database
MEDIUM,House Robber,36.7,0.5198830720979272,https://leetcode.com/problems/house-robber,"Array, Dynamic Programming"
HARD,Binary Tree Maximum Path Sum,36.7,0.40904480368731844,https://leetcode.com/problems/binary-tree-maximum-path-sum,"Dynamic Programming, Tree, Depth-First Search, Binary Tree"
EASY,Maximum Average Subarray I,36.7,0.4468313517954666,https://leetcode.com/problems/maximum-average-subarray-i,"Array, Sliding Window"
HARD,Longest Valid Parentheses,36.7,0.35694464228573786,https://leetcode.com/problems/longest-valid-parentheses,"String, Dynamic Programming, Stack"
HARD,Split Array Largest Sum,36.7,0.5740391597510374,https://leetcode.com/problems/split-array-largest-sum,"Array, Binary Search, Dynamic Programming, Greedy, Prefix Sum"
MEDIUM,The Earliest Moment When Everyone Become Friends,36.7,0.6558497353527486,https://leetcode.com/problems/the-earliest-moment-when-everyone-become-friends,"Array, Union Find, Sorting"
HARD,Text Justification,36.7,0.47093296579330096,https://leetcode.com/problems/text-justification,"Array, String, Simulation"
EASY,Plus One,36.7,0.4704643565412813,https://leetcode.com/problems/plus-one,"Array, Math"
EASY,Find Customer Referee,36.7,0.7160244833030334,https://leetcode.com/problems/find-customer-referee,Database
MEDIUM,Hand of Straights,28.9,0.5687187307271782,https://leetcode.com/problems/hand-of-straights,"Array, Hash Table, Greedy, Sorting"
EASY,Palindrome Linked List,28.9,0.5516246861737641,https://leetcode.com/problems/palindrome-linked-list,"Linked List, Two Pointers, Stack, Recursion"
MEDIUM,Surrounded Regions,28.9,0.4203103247931608,https://leetcode.com/problems/surrounded-regions,"Array, Depth-First Search, Breadth-First Search, Union Find, Matrix"
EASY,Sqrt(x),28.9,0.40027067544753053,https://leetcode.com/problems/sqrtx,"Math, Binary Search"
MEDIUM,Two Sum II - Input Array Is Sorted,28.9,0.6287751406822689,https://leetcode.com/problems/two-sum-ii-input-array-is-sorted,"Array, Two Pointers, Binary Search"
EASY,Reverse Linked List,28.9,0.7865003484224354,https://leetcode.com/problems/reverse-linked-list,"Linked List, Recursion"
MEDIUM,Online Stock Span,28.9,0.6720055080034135,https://leetcode.com/problems/online-stock-span,"Stack, Design, Monotonic Stack, Data Stream"
EASY,Concatenation of Array,28.9,0.9036397650070563,https://leetcode.com/problems/concatenation-of-array,"Array, Simulation"
MEDIUM,String Compression,28.9,0.5727269065965125,https://leetcode.com/problems/string-compression,"Two Pointers, String"
EASY,Transpose Matrix,28.9,0.7366755446610256,https://leetcode.com/problems/transpose-matrix,"Array, Matrix, Simulation"
EASY,Check if One String Swap Can Make Strings Equal,28.9,0.4946871351172619,https://leetcode.com/problems/check-if-one-string-swap-can-make-strings-equal,"Hash Table, String, Counting"
MEDIUM,Maximum Width Ramp,28.9,0.5563674103588033,https://leetcode.com/problems/maximum-width-ramp,"Array, Two Pointers, Stack, Monotonic Stack"
MEDIUM,Sort Colors,28.9,0.6636207416579357,https://leetcode.com/problems/sort-colors,"Array, Two Pointers, Sorting"
EASY,Contains Duplicate,28.9,0.6281694185137757,https://leetcode.com/problems/contains-duplicate,"Array, Hash Table, Sorting"
HARD,Find Median from Data Stream,28.9,0.5297430019089757,https://leetcode.com/problems/find-median-from-data-stream,"Two Pointers, Design, Sorting, Heap (Priority Queue), Data Stream"
HARD,Merge k Sorted Lists,28.9,0.5579527291964019,https://leetcode.com/problems/merge-k-sorted-lists,"Linked List, Divide and Conquer, Heap (Priority Queue), Merge Sort"
EASY,Maximum Ascending Subarray Sum,28.9,0.6655727438594801,https://leetcode.com/problems/maximum-ascending-subarray-sum,Array
MEDIUM,Construct Binary Tree from Preorder and Inorder Traversal,28.9,0.6613180852208892,https://leetcode.com/problems/construct-binary-tree-from-preorder-and-inorder-traversal,"Array, Hash Table, Divide and Conquer, Tree, Binary Tree"
MEDIUM,Remove Duplicates from Sorted Array II,28.9,0.6215197832859646,https://leetcode.com/problems/remove-duplicates-from-sorted-array-ii,"Array, Two Pointers"
