Difficulty,Title,Frequency,Acceptance Rate,Link,Topics
EASY,Best Time to Buy and Sell Stock,100.0,0.5477002021716998,https://leetcode.com/problems/best-time-to-buy-and-sell-stock,"Array, Dynamic Programming"
MEDIUM,Remove Duplicate Letters,92.6,0.5084049837644269,https://leetcode.com/problems/remove-duplicate-letters,"String, Stack, Greedy, Monotonic Stack"
MEDIUM,Maximal Network Rank,92.6,0.6535797551353211,https://leetcode.com/problems/maximal-network-rank,Graph
MEDIUM,Minimum Fuel Cost to Report to the Capital,82.1,0.6414342964201399,https://leetcode.com/problems/minimum-fuel-cost-to-report-to-the-capital,"Tree, Depth-First Search, Breadth-First Search, Graph"
MEDIUM,Reorder Routes to Make All Paths Lead to the City Zero,82.1,0.6478587237952059,https://leetcode.com/problems/reorder-routes-to-make-all-paths-lead-to-the-city-zero,"Depth-First Search, Breadth-First Search, Graph"
HARD,Robot Room Cleaner,82.1,0.7716071147890585,https://leetcode.com/problems/robot-room-cleaner,"Backtracking, Interactive"
MEDIUM,Subsequence of Size K With the Largest Even Sum,82.1,0.35719341709431957,https://leetcode.com/problems/subsequence-of-size-k-with-the-largest-even-sum,"Array, Greedy, Sorting"
EASY,Counting Elements,82.1,0.6039435654977697,https://leetcode.com/problems/counting-elements,"Array, Hash Table"
