Difficulty,Title,Frequency,Acceptance Rate,Link,Topics
EASY,Create a Session Bar Chart,100.0,0.7496541353383459,https://leetcode.com/problems/create-a-session-bar-chart,Database
MEDIUM,Design a File Sharing System,100.0,0.4188846122348702,https://leetcode.com/problems/design-a-file-sharing-system,"Hash Table, Design, Sorting, Heap (Priority Queue), Data Stream"
MEDIUM,Toss Strange Coins,100.0,0.5810946589106293,https://leetcode.com/problems/toss-strange-coins,"Array, Math, Dynamic Programming, Probability and Statistics"
MEDIUM,LRU Cache,92.2,0.4443116153250814,https://leetcode.com/problems/lru-cache,"Hash Table, Linked List, Design, Doubly-Linked List"
EASY,Reverse Vowels of a String,64.9,0.5702008271336859,https://leetcode.com/problems/reverse-vowels-of-a-string,"Two Pointers, String"
MEDIUM,Letter Combinations of a Phone Number,64.9,0.6308037693480621,https://leetcode.com/problems/letter-combinations-of-a-phone-number,"Hash Table, String, Backtracking"
