Difficulty,Title,Frequency,Acceptance Rate,Link,Topics
MEDIUM,Car Fleet,100.0,0.5294768111290762,https://leetcode.com/problems/car-fleet,"Array, Stack, Sorting, Monotonic Stack"
MEDIUM,Check If Word Is Valid After Substitutions,100.0,0.6059548305939002,https://leetcode.com/problems/check-if-word-is-valid-after-substitutions,"String, Stack"
HARD,Delivering Boxes from Storage to Ports,97.5,0.39180497925311203,https://leetcode.com/problems/delivering-boxes-from-storage-to-ports,"Array, Dynamic Programming, Segment Tree, Queue, Heap (Priority Queue), Prefix Sum, Monotonic Queue"
MEDIUM,Minimum Processing Time,97.5,0.6956656346749226,https://leetcode.com/problems/minimum-processing-time,"Array, Greedy, Sorting"
MEDIUM,Swap For Longest Repeated Character Substring,97.5,0.4368318338590699,https://leetcode.com/problems/swap-for-longest-repeated-character-substring,"Hash Table, String, Sliding Window"
MEDIUM,Maximum Sum of an Hourglass,97.5,0.7580736355472777,https://leetcode.com/problems/maximum-sum-of-an-hourglass,"Array, Matrix, Prefix Sum"
MEDIUM,Detect Cycles in 2D Grid,97.5,0.49614139905402044,https://leetcode.com/problems/detect-cycles-in-2d-grid,"Array, Depth-First Search, Breadth-First Search, Union Find, Matrix"
MEDIUM,Grumpy Bookstore Owner,97.5,0.6410552934283159,https://leetcode.com/problems/grumpy-bookstore-owner,"Array, Sliding Window"
HARD,Online Majority Element In Subarray,97.5,0.42200279502394106,https://leetcode.com/problems/online-majority-element-in-subarray,"Array, Binary Search, Design, Binary Indexed Tree, Segment Tree"
MEDIUM,Partitioning Into Minimum Number Of Deci-Binary Numbers,97.5,0.8876803883132642,https://leetcode.com/problems/partitioning-into-minimum-number-of-deci-binary-numbers,"String, Greedy"
MEDIUM,Broken Calculator,97.5,0.5497359422108011,https://leetcode.com/problems/broken-calculator,"Math, Greedy"
HARD,First Missing Positive,88.1,0.4063421918370058,https://leetcode.com/problems/first-missing-positive,"Array, Hash Table"
MEDIUM,LRU Cache,79.3,0.4443108943898094,https://leetcode.com/problems/lru-cache,"Hash Table, Linked List, Design, Doubly-Linked List"
MEDIUM,Pacific Atlantic Water Flow,73.5,0.5691465973316736,https://leetcode.com/problems/pacific-atlantic-water-flow,"Array, Depth-First Search, Breadth-First Search, Matrix"
MEDIUM,Group Anagrams,73.5,0.7033701148221215,https://leetcode.com/problems/group-anagrams,"Array, Hash Table, String, Sorting"
MEDIUM,Rotting Oranges,73.5,0.5596867189747665,https://leetcode.com/problems/rotting-oranges,"Array, Breadth-First Search, Matrix"
MEDIUM,Boundary of Binary Tree,73.5,0.46787119736548405,https://leetcode.com/problems/boundary-of-binary-tree,"Tree, Depth-First Search, Binary Tree"
MEDIUM,Top K Frequent Elements,65.9,0.6408029102905588,https://leetcode.com/problems/top-k-frequent-elements,"Array, Hash Table, Divide and Conquer, Sorting, Heap (Priority Queue), Bucket Sort, Counting, Quickselect"
EASY,Two Sum,65.9,0.5507385637230168,https://leetcode.com/problems/two-sum,"Array, Hash Table"
MEDIUM,Spiral Matrix,65.9,0.5293297276822649,https://leetcode.com/problems/spiral-matrix,"Array, Matrix, Simulation"
HARD,Sliding Window Maximum,65.9,0.4724674456414386,https://leetcode.com/problems/sliding-window-maximum,"Array, Queue, Sliding Window, Heap (Priority Queue), Monotonic Queue"
MEDIUM,Coin Change,55.4,0.45813218245345644,https://leetcode.com/problems/coin-change,"Array, Dynamic Programming, Breadth-First Search"
MEDIUM,Longest Common Subsequence,55.4,0.5799221903340894,https://leetcode.com/problems/longest-common-subsequence,"String, Dynamic Programming"
MEDIUM,Amount of Time for Binary Tree to Be Infected,55.4,0.6318869294231363,https://leetcode.com/problems/amount-of-time-for-binary-tree-to-be-infected,"Hash Table, Tree, Depth-First Search, Breadth-First Search, Binary Tree"
MEDIUM,Find Minimum in Rotated Sorted Array,55.4,0.5215059995992812,https://leetcode.com/problems/find-minimum-in-rotated-sorted-array,"Array, Binary Search"
MEDIUM,Number of Islands,55.4,0.6158100483120172,https://leetcode.com/problems/number-of-islands,"Array, Depth-First Search, Breadth-First Search, Union Find, Matrix"
MEDIUM,Binary Tree Zigzag Level Order Traversal,55.4,0.610093619617652,https://leetcode.com/problems/binary-tree-zigzag-level-order-traversal,"Tree, Breadth-First Search, Binary Tree"
MEDIUM,Word Break,55.4,0.47875198203907365,https://leetcode.com/problems/word-break,"Array, Hash Table, String, Dynamic Programming, Trie, Memoization"
MEDIUM,3Sum,55.4,0.3642312092521535,https://leetcode.com/problems/3sum,"Array, Two Pointers, Sorting"
MEDIUM,Min Cost to Connect All Points,55.4,0.6837618657969244,https://leetcode.com/problems/min-cost-to-connect-all-points,"Array, Union Find, Graph, Minimum Spanning Tree"
MEDIUM,Longest Palindromic Substring,55.4,0.35298394789595955,https://leetcode.com/problems/longest-palindromic-substring,"Two Pointers, String, Dynamic Programming"
HARD,Reverse Nodes in k-Group,55.4,0.620463138604683,https://leetcode.com/problems/reverse-nodes-in-k-group,"Linked List, Recursion"
MEDIUM,Product of Array Except Self,55.4,0.6738342224272461,https://leetcode.com/problems/product-of-array-except-self,"Array, Prefix Sum"
MEDIUM,Minimum Number of Swaps to Make the String Balanced,55.4,0.7804247434736815,https://leetcode.com/problems/minimum-number-of-swaps-to-make-the-string-balanced,"Two Pointers, String, Stack, Greedy"
EASY,Maximum Product of Three Numbers,55.4,0.4524232930666796,https://leetcode.com/problems/maximum-product-of-three-numbers,"Array, Math, Sorting"
EASY,Best Time to Buy and Sell Stock,55.4,0.5476983417277067,https://leetcode.com/problems/best-time-to-buy-and-sell-stock,"Array, Dynamic Programming"
MEDIUM,All Nodes Distance K in Binary Tree,55.4,0.6585740529583175,https://leetcode.com/problems/all-nodes-distance-k-in-binary-tree,"Hash Table, Tree, Depth-First Search, Breadth-First Search, Binary Tree"
MEDIUM,Container With Most Water,55.4,0.5717353155814536,https://leetcode.com/problems/container-with-most-water,"Array, Two Pointers, Greedy"
EASY,Longest Common Prefix,55.4,0.4488793519217786,https://leetcode.com/problems/longest-common-prefix,"String, Trie"
MEDIUM,Jump Game II,55.4,0.4113848395686171,https://leetcode.com/problems/jump-game-ii,"Array, Dynamic Programming, Greedy"
EASY,Degree of an Array,55.4,0.5713919458681063,https://leetcode.com/problems/degree-of-an-array,"Array, Hash Table"
HARD,Word Ladder,55.4,0.4184674434956454,https://leetcode.com/problems/word-ladder,"Hash Table, String, Breadth-First Search"
MEDIUM,Course Schedule,55.4,0.484768925908594,https://leetcode.com/problems/course-schedule,"Depth-First Search, Breadth-First Search, Graph, Topological Sort"
MEDIUM,Add Two Numbers,55.4,0.45439808101489754,https://leetcode.com/problems/add-two-numbers,"Linked List, Math, Recursion"
MEDIUM,Heaters,55.4,0.3940185763508764,https://leetcode.com/problems/heaters,"Array, Two Pointers, Binary Search, Sorting"
MEDIUM,Longest Continuous Subarray With Absolute Diff Less Than or Equal to Limit,55.4,0.5669944968727209,https://leetcode.com/problems/longest-continuous-subarray-with-absolute-diff-less-than-or-equal-to-limit,"Array, Queue, Sliding Window, Heap (Priority Queue), Ordered Set, Monotonic Queue"
