Difficulty,Title,Frequency,Acceptance Rate,Link,Topics
HARD,Trapping Rain Water,100.0,0.6428745738503359,https://leetcode.com/problems/trapping-rain-water,"Array, Two Pointers, Dynamic Programming, Stack, Monotonic Stack"
MEDIUM,Path Sum IV,100.0,0.6260295504558315,https://leetcode.com/problems/path-sum-iv,"Array, Hash Table, Tree, Depth-First Search, Binary Tree"
MEDIUM,Split Concatenated Strings,100.0,0.43278668536243375,https://leetcode.com/problems/split-concatenated-strings,"Array, String, Greedy"
HARD,Split Array with Equal Sum,100.0,0.5015691342071257,https://leetcode.com/problems/split-array-with-equal-sum,"Array, Hash Table, Prefix Sum"
MEDIUM,Valid Parenthesis String,100.0,0.38624004656918254,https://leetcode.com/problems/valid-parenthesis-string,"String, Dynamic Programming, Stack, Greedy"
