Difficulty,Title,Frequency,Acceptance Rate,Link,Topics
EASY,Longest Common Prefix,100.0,0.448880176953031,https://leetcode.com/problems/longest-common-prefix,"String, Trie"
MEDIUM,Perfect Squares,84.5,0.5543524271181812,https://leetcode.com/problems/perfect-squares,"Math, Dynamic Programming, Breadth-First Search"
MEDIUM,Reverse Linked List II,84.5,0.491015192475531,https://leetcode.com/problems/reverse-linked-list-ii,Linked List
MEDIUM,Find All Anagrams in a String,84.5,0.5182233097696111,https://leetcode.com/problems/find-all-anagrams-in-a-string,"Hash Table, String, Sliding Window"
EASY,Remove Duplicates from Sorted List,78.1,0.5435991175358115,https://leetcode.com/problems/remove-duplicates-from-sorted-list,Linked List
MEDIUM,Binary Tree Level Order Traversal II,69.1,0.6538304603432218,https://leetcode.com/problems/binary-tree-level-order-traversal-ii,"Tree, Breadth-First Search, Binary Tree"
MEDIUM,Permutation in String,69.1,0.4684192212827718,https://leetcode.com/problems/permutation-in-string,"Hash Table, Two Pointers, String, Sliding Window"
MEDIUM,Random Pick with Weight,69.1,0.48209552994381916,https://leetcode.com/problems/random-pick-with-weight,"Array, Math, Binary Search, Prefix Sum, Randomized"
EASY,Merge Two Sorted Lists,69.1,0.6628979314823638,https://leetcode.com/problems/merge-two-sorted-lists,"Linked List, Recursion"
EASY,Binary Tree Paths,69.1,0.6580814385260796,https://leetcode.com/problems/binary-tree-paths,"String, Backtracking, Tree, Depth-First Search, Binary Tree"
