Difficulty,Title,Frequency,Acceptance Rate,Link,Topics
EASY,Best Time to Buy and Sell Stock,100.0,0.5477004477376146,https://leetcode.com/problems/best-time-to-buy-and-sell-stock,"Array, Dynamic Programming"
MEDIUM,Container With Most Water,89.6,0.5717353463452212,https://leetcode.com/problems/container-with-most-water,"Array, Two Pointers, Greedy"
EASY,Roman to Integer,89.6,0.6415430198713148,https://leetcode.com/problems/roman-to-integer,"Hash Table, Math, String"
MEDIUM,Longest Palindromic Substring,89.6,0.3529865993627295,https://leetcode.com/problems/longest-palindromic-substring,"Two Pointers, String, Dynamic Programming"
EASY,Valid Palindrome,89.6,0.5015528096264289,https://leetcode.com/problems/valid-palindrome,"Two Pointers, String"
