Difficulty,Title,Frequency,Acceptance Rate,Link,Topics
MEDIUM,Integer to Roman,100.0,0.678587134979957,https://leetcode.com/problems/integer-to-roman,"Hash Table, Math, String"
MEDIUM,Number of Islands,100.0,0.6158152512063539,https://leetcode.com/problems/number-of-islands,"Array, Depth-First Search, Breadth-First Search, Union Find, Matrix"
MEDIUM,Longest Substring Without Repeating Characters,100.0,0.36326979143767507,https://leetcode.com/problems/longest-substring-without-repeating-characters,"Hash Table, String, Sliding Window"
EASY,Merge Two Sorted Lists,100.0,0.662897564015706,https://leetcode.com/problems/merge-two-sorted-lists,"Linked List, Recursion"
MEDIUM,Reverse Words in a String,100.0,0.5006759044887522,https://leetcode.com/problems/reverse-words-in-a-string,"Two Pointers, String"
