Difficulty,Title,Frequency,Acceptance Rate,Link,Topics
EASY,Two Sum,100.0,0.5507380058616134,https://leetcode.com/problems/two-sum,"Array, Hash Table"
EASY,Longest Common Prefix,79.1,0.44887909992484765,https://leetcode.com/problems/longest-common-prefix,"String, Trie"
MEDIUM,3Sum,78.5,0.3642306371984945,https://leetcode.com/problems/3sum,"Array, Two Pointers, Sorting"
HARD,Median of Two Sorted Arrays,76.2,0.429393714636432,https://leetcode.com/problems/median-of-two-sorted-arrays,"Array, Binary Search, Divide and Conquer"
MEDIUM,Longest Substring Without Repeating Characters,75.9,0.36326698199128166,https://leetcode.com/problems/longest-substring-without-repeating-characters,"Hash Table, String, Sliding Window"
EASY,Roman to Integer,74.4,0.6415382294669726,https://leetcode.com/problems/roman-to-integer,"Hash Table, Math, String"
MEDIUM,Add Two Numbers,72.9,0.45439666615310353,https://leetcode.com/problems/add-two-numbers,"Linked List, Math, Recursion"
EASY,Merge Sorted Array,72.9,0.5225683072259871,https://leetcode.com/problems/merge-sorted-array,"Array, Two Pointers, Sorting"
MEDIUM,Reverse Integer,72.5,0.29864317763528553,https://leetcode.com/problems/reverse-integer,Math
HARD,Trapping Rain Water,71.2,0.6428751630743017,https://leetcode.com/problems/trapping-rain-water,"Array, Two Pointers, Dynamic Programming, Stack, Monotonic Stack"
EASY,Climbing Stairs,67.8,0.5334308111113989,https://leetcode.com/problems/climbing-stairs,"Math, Dynamic Programming, Memoization"
EASY,Palindrome Number,67.8,0.5865360557280641,https://leetcode.com/problems/palindrome-number,Math
MEDIUM,Container With Most Water,66.8,0.5717347175888353,https://leetcode.com/problems/container-with-most-water,"Array, Two Pointers, Greedy"
MEDIUM,Group Anagrams,66.2,0.7033699227766231,https://leetcode.com/problems/group-anagrams,"Array, Hash Table, String, Sorting"
EASY,Remove Element,65.6,0.594380255866597,https://leetcode.com/problems/remove-element,"Array, Two Pointers"
EASY,Valid Parentheses,65.6,0.4184517326939315,https://leetcode.com/problems/valid-parentheses,"String, Stack"
MEDIUM,Longest Palindromic Substring,65.0,0.35298360795359024,https://leetcode.com/problems/longest-palindromic-substring,"Two Pointers, String, Dynamic Programming"
EASY,Remove Duplicates from Sorted Array,65.0,0.594507304510471,https://leetcode.com/problems/remove-duplicates-from-sorted-array,"Array, Two Pointers"
MEDIUM,Next Permutation,64.4,0.42324029946606845,https://leetcode.com/problems/next-permutation,"Array, Two Pointers"
EASY,Merge Two Sorted Lists,64.4,0.6628950542694931,https://leetcode.com/problems/merge-two-sorted-lists,"Linked List, Recursion"
MEDIUM,Spiral Matrix,63.1,0.5293292273196886,https://leetcode.com/problems/spiral-matrix,"Array, Matrix, Simulation"
MEDIUM,Set Matrix Zeroes,60.9,0.5893209483631097,https://leetcode.com/problems/set-matrix-zeroes,"Array, Hash Table, Matrix"
MEDIUM,Maximum Subarray,57.6,0.5173370618539692,https://leetcode.com/problems/maximum-subarray,"Array, Divide and Conquer, Dynamic Programming"
MEDIUM,Generate Parentheses,57.6,0.7652984497625767,https://leetcode.com/problems/generate-parentheses,"String, Dynamic Programming, Backtracking"
MEDIUM,Letter Combinations of a Phone Number,57.6,0.6308017798167616,https://leetcode.com/problems/letter-combinations-of-a-phone-number,"Hash Table, String, Backtracking"
MEDIUM,Find First and Last Position of Element in Sorted Array,56.7,0.46149675744309815,https://leetcode.com/problems/find-first-and-last-position-of-element-in-sorted-array,"Array, Binary Search"
MEDIUM,Rotate Image,54.7,0.7717077385834604,https://leetcode.com/problems/rotate-image,"Array, Math, Matrix"
MEDIUM,Jump Game,54.7,0.3911364503499886,https://leetcode.com/problems/jump-game,"Array, Dynamic Programming, Greedy"
MEDIUM,Integer to Roman,53.6,0.6785811547123167,https://leetcode.com/problems/integer-to-roman,"Hash Table, Math, String"
MEDIUM,Merge Intervals,53.6,0.4880650144927678,https://leetcode.com/problems/merge-intervals,"Array, Sorting"
EASY,Plus One,53.6,0.4704641275180003,https://leetcode.com/problems/plus-one,"Array, Math"
HARD,Merge k Sorted Lists,51.3,0.5579528330363718,https://leetcode.com/problems/merge-k-sorted-lists,"Linked List, Divide and Conquer, Heap (Priority Queue), Merge Sort"
MEDIUM,Permutations,51.3,0.8013989296294045,https://leetcode.com/problems/permutations,"Array, Backtracking"
MEDIUM,Sort Colors,51.3,0.6636204958851518,https://leetcode.com/problems/sort-colors,"Array, Two Pointers, Sorting"
MEDIUM,Remove Duplicates from Sorted Array II,50.0,0.6215218059731764,https://leetcode.com/problems/remove-duplicates-from-sorted-array-ii,"Array, Two Pointers"
MEDIUM,Divide Two Integers,50.0,0.1814598188759421,https://leetcode.com/problems/divide-two-integers,"Math, Bit Manipulation"
MEDIUM,Search in Rotated Sorted Array,50.0,0.4232396555027368,https://leetcode.com/problems/search-in-rotated-sorted-array,"Array, Binary Search"
EASY,Sqrt(x),50.0,0.40027083939033725,https://leetcode.com/problems/sqrtx,"Math, Binary Search"
HARD,Largest Rectangle in Histogram,48.6,0.46599497481155544,https://leetcode.com/problems/largest-rectangle-in-histogram,"Array, Stack, Monotonic Stack"
HARD,First Missing Positive,48.6,0.4063432481245312,https://leetcode.com/problems/first-missing-positive,"Array, Hash Table"
MEDIUM,Unique Paths,48.6,0.654033391624526,https://leetcode.com/problems/unique-paths,"Math, Dynamic Programming, Combinatorics"
MEDIUM,Valid Sudoku,47.0,0.6165263122770125,https://leetcode.com/problems/valid-sudoku,"Array, Hash Table, Matrix"
MEDIUM,3Sum Closest,45.4,0.46598247796697967,https://leetcode.com/problems/3sum-closest,"Array, Two Pointers, Sorting"
MEDIUM,Subsets,45.4,0.8025894997461674,https://leetcode.com/problems/subsets,"Array, Backtracking, Bit Manipulation"
MEDIUM,"Pow(x, n)",45.4,0.36477399950977474,https://leetcode.com/problems/powx-n,"Math, Recursion"
EASY,Find the Index of the First Occurrence in a String,45.4,0.44463584552574936,https://leetcode.com/problems/find-the-index-of-the-first-occurrence-in-a-string,"Two Pointers, String, String Matching"
MEDIUM,Reverse Linked List II,45.4,0.4910144732935301,https://leetcode.com/problems/reverse-linked-list-ii,Linked List
EASY,Length of Last Word,45.4,0.554460250999444,https://leetcode.com/problems/length-of-last-word,String
EASY,Search Insert Position,45.4,0.4833842976341976,https://leetcode.com/problems/search-insert-position,"Array, Binary Search"
HARD,Reverse Nodes in k-Group,43.6,0.6204624534215137,https://leetcode.com/problems/reverse-nodes-in-k-group,"Linked List, Recursion"
MEDIUM,Jump Game II,43.6,0.41138458370460385,https://leetcode.com/problems/jump-game-ii,"Array, Dynamic Programming, Greedy"
MEDIUM,Combination Sum II,43.6,0.5721007171008698,https://leetcode.com/problems/combination-sum-ii,"Array, Backtracking"
MEDIUM,Construct Binary Tree from Preorder and Inorder Traversal,43.6,0.6613182358584598,https://leetcode.com/problems/construct-binary-tree-from-preorder-and-inorder-traversal,"Array, Hash Table, Divide and Conquer, Tree, Binary Tree"
MEDIUM,String to Integer (atoi),43.6,0.1871713595677563,https://leetcode.com/problems/string-to-integer-atoi,String
EASY,Binary Tree Inorder Traversal,43.6,0.7800946934605403,https://leetcode.com/problems/binary-tree-inorder-traversal,"Stack, Tree, Depth-First Search, Binary Tree"
MEDIUM,Search a 2D Matrix,41.6,0.5177721985158003,https://leetcode.com/problems/search-a-2d-matrix,"Array, Binary Search, Matrix"
MEDIUM,Binary Tree Zigzag Level Order Traversal,41.6,0.6100933771069217,https://leetcode.com/problems/binary-tree-zigzag-level-order-traversal,"Tree, Breadth-First Search, Binary Tree"
HARD,Minimum Window Substring,41.6,0.44664959668017445,https://leetcode.com/problems/minimum-window-substring,"Hash Table, String, Sliding Window"
MEDIUM,Swap Nodes in Pairs,41.6,0.6651424283411775,https://leetcode.com/problems/swap-nodes-in-pairs,"Linked List, Recursion"
EASY,Maximum Depth of Binary Tree,39.4,0.7675474131768223,https://leetcode.com/problems/maximum-depth-of-binary-tree,"Tree, Depth-First Search, Breadth-First Search, Binary Tree"
MEDIUM,Zigzag Conversion,39.4,0.5079122239801885,https://leetcode.com/problems/zigzag-conversion,String
HARD,Wildcard Matching,39.4,0.2936448764073223,https://leetcode.com/problems/wildcard-matching,"String, Dynamic Programming, Greedy, Recursion"
MEDIUM,Partition List,39.4,0.5832741355938129,https://leetcode.com/problems/partition-list,"Linked List, Two Pointers"
MEDIUM,4Sum,36.9,0.37601615398210986,https://leetcode.com/problems/4sum,"Array, Two Pointers, Sorting"
MEDIUM,Remove Nth Node From End of List,36.9,0.4810542231663091,https://leetcode.com/problems/remove-nth-node-from-end-of-list,"Linked List, Two Pointers"
MEDIUM,Word Search,36.9,0.44626243009839556,https://leetcode.com/problems/word-search,"Array, String, Backtracking, Depth-First Search, Matrix"
MEDIUM,Spiral Matrix II,36.9,0.7294074516081444,https://leetcode.com/problems/spiral-matrix-ii,"Array, Matrix, Simulation"
HARD,Longest Valid Parentheses,36.9,0.35694464228573786,https://leetcode.com/problems/longest-valid-parentheses,"String, Dynamic Programming, Stack"
MEDIUM,Insert Interval,36.9,0.42944206454325395,https://leetcode.com/problems/insert-interval,Array
EASY,Symmetric Tree,36.9,0.5863386522651893,https://leetcode.com/problems/symmetric-tree,"Tree, Depth-First Search, Breadth-First Search, Binary Tree"
HARD,Sudoku Solver,36.9,0.636724036210914,https://leetcode.com/problems/sudoku-solver,"Array, Hash Table, Backtracking, Matrix"
MEDIUM,Combinations,34.1,0.7228625269009074,https://leetcode.com/problems/combinations,Backtracking
EASY,Same Tree,34.1,0.6443819934214408,https://leetcode.com/problems/same-tree,"Tree, Depth-First Search, Breadth-First Search, Binary Tree"
MEDIUM,Validate Binary Search Tree,34.1,0.3398041191887885,https://leetcode.com/problems/validate-binary-search-tree,"Tree, Depth-First Search, Binary Search Tree, Binary Tree"
HARD,N-Queens,34.1,0.7166909301524685,https://leetcode.com/problems/n-queens,"Array, Backtracking"
MEDIUM,Edit Distance,34.1,0.581899589836725,https://leetcode.com/problems/edit-distance,"String, Dynamic Programming"
MEDIUM,Combination Sum,34.1,0.739312724075368,https://leetcode.com/problems/combination-sum,"Array, Backtracking"
HARD,Permutation Sequence,34.1,0.49172109247041484,https://leetcode.com/problems/permutation-sequence,"Math, Recursion"
EASY,Add Binary,34.1,0.5519212953877572,https://leetcode.com/problems/add-binary,"Math, String, Bit Manipulation, Simulation"
EASY,Remove Duplicates from Sorted List,30.7,0.5435975840395191,https://leetcode.com/problems/remove-duplicates-from-sorted-list,Linked List
MEDIUM,Rotate List,30.7,0.3940256152163199,https://leetcode.com/problems/rotate-list,"Linked List, Two Pointers"
HARD,Text Justification,30.7,0.47093296579330096,https://leetcode.com/problems/text-justification,"Array, String, Simulation"
MEDIUM,Construct Binary Tree from Inorder and Postorder Traversal,26.7,0.6570289620942351,https://leetcode.com/problems/construct-binary-tree-from-inorder-and-postorder-traversal,"Array, Hash Table, Divide and Conquer, Tree, Binary Tree"
MEDIUM,Count and Say,26.7,0.5789703915376176,https://leetcode.com/problems/count-and-say,String
MEDIUM,Unique Paths II,26.7,0.42759293119426867,https://leetcode.com/problems/unique-paths-ii,"Array, Dynamic Programming, Matrix"
MEDIUM,Restore IP Addresses,26.7,0.5238319309402614,https://leetcode.com/problems/restore-ip-addresses,"String, Backtracking"
MEDIUM,Search in Rotated Sorted Array II,26.7,0.3858970645425734,https://leetcode.com/problems/search-in-rotated-sorted-array-ii,"Array, Binary Search"
HARD,Substring with Concatenation of All Words,26.7,0.3279235992297924,https://leetcode.com/problems/substring-with-concatenation-of-all-words,"Hash Table, String, Sliding Window"
MEDIUM,Minimum Path Sum,21.7,0.6584779754270131,https://leetcode.com/problems/minimum-path-sum,"Array, Dynamic Programming, Matrix"
MEDIUM,Subsets II,21.7,0.5890592778362556,https://leetcode.com/problems/subsets-ii,"Array, Backtracking, Bit Manipulation"
MEDIUM,Decode Ways,21.7,0.36105053640243673,https://leetcode.com/problems/decode-ways,"String, Dynamic Programming"
MEDIUM,Simplify Path,21.7,0.4659590867505188,https://leetcode.com/problems/simplify-path,"String, Stack"
HARD,Maximal Rectangle,21.7,0.5288766460503644,https://leetcode.com/problems/maximal-rectangle,"Array, Dynamic Programming, Stack, Matrix, Monotonic Stack"
HARD,Regular Expression Matching,21.7,0.28971867492351294,https://leetcode.com/problems/regular-expression-matching,"String, Dynamic Programming, Recursion"
MEDIUM,Multiply Strings,21.7,0.4183026038253261,https://leetcode.com/problems/multiply-strings,"Math, String, Simulation"
MEDIUM,Remove Duplicates from Sorted List II,15.1,0.492636696849424,https://leetcode.com/problems/remove-duplicates-from-sorted-list-ii,"Linked List, Two Pointers"
MEDIUM,Binary Tree Level Order Traversal,15.1,0.6982012546707773,https://leetcode.com/problems/binary-tree-level-order-traversal,"Tree, Breadth-First Search, Binary Tree"
MEDIUM,Permutations II,15.1,0.6099587606300106,https://leetcode.com/problems/permutations-ii,"Array, Backtracking, Sorting"
MEDIUM,Unique Binary Search Trees,15.1,0.62136879296033,https://leetcode.com/problems/unique-binary-search-trees,"Math, Dynamic Programming, Tree, Binary Search Tree, Binary Tree"
MEDIUM,Unique Binary Search Trees II,15.1,0.5973929437759685,https://leetcode.com/problems/unique-binary-search-trees-ii,"Dynamic Programming, Backtracking, Tree, Binary Search Tree, Binary Tree"
