Difficulty,Title,Frequency,Acceptance Rate,Link,Topics
MEDIUM,Search in Rotated Sorted Array,100.0,0.42323985722321633,https://leetcode.com/problems/search-in-rotated-sorted-array,"Array, Binary Search"
EASY,Two Sum,96.3,0.5507381358292469,https://leetcode.com/problems/two-sum,"Array, Hash Table"
EASY,Best Time to Buy and Sell Stock,92.1,0.547698124538477,https://leetcode.com/problems/best-time-to-buy-and-sell-stock,"Array, Dynamic Programming"
MEDIUM,Group Anagrams,92.1,0.7033698794136874,https://leetcode.com/problems/group-anagrams,"Array, Hash Table, String, Sorting"
EASY,Split the Array,87.1,0.5940943729402544,https://leetcode.com/problems/split-the-array,"Array, Hash Table, Counting"
EASY,Longest Common Prefix,81.0,0.44887905919285687,https://leetcode.com/problems/longest-common-prefix,"String, Trie"
HARD,Text Justification,73.1,0.47093296579330096,https://leetcode.com/problems/text-justification,"Array, String, Simulation"
EASY,Create Target Array in the Given Order,73.1,0.8615133318813976,https://leetcode.com/problems/create-target-array-in-the-given-order,"Array, Simulation"
EASY,Rotate String,73.1,0.6353774820907521,https://leetcode.com/problems/rotate-string,"String, String Matching"
MEDIUM,Daily Temperatures,73.1,0.6696877318640755,https://leetcode.com/problems/daily-temperatures,"Array, Stack, Monotonic Stack"
MEDIUM,Maximum Number of Events That Can Be Attended,73.1,0.32741707087340693,https://leetcode.com/problems/maximum-number-of-events-that-can-be-attended,"Array, Greedy, Sorting, Heap (Priority Queue)"
MEDIUM,Reverse Words in a String,73.1,0.5006652102306224,https://leetcode.com/problems/reverse-words-in-a-string,"Two Pointers, String"
MEDIUM,Search a 2D Matrix,73.1,0.5177721819376666,https://leetcode.com/problems/search-a-2d-matrix,"Array, Binary Search, Matrix"
MEDIUM,3Sum,73.1,0.3642306812514666,https://leetcode.com/problems/3sum,"Array, Two Pointers, Sorting"
MEDIUM,Longest Substring Without Repeating Characters,73.1,0.3632672400402751,https://leetcode.com/problems/longest-substring-without-repeating-characters,"Hash Table, String, Sliding Window"
HARD,Median of Two Sorted Arrays,73.1,0.4293936186016383,https://leetcode.com/problems/median-of-two-sorted-arrays,"Array, Binary Search, Divide and Conquer"
HARD,Trapping Rain Water,73.1,0.6428749724369252,https://leetcode.com/problems/trapping-rain-water,"Array, Two Pointers, Dynamic Programming, Stack, Monotonic Stack"
MEDIUM,Walls and Gates,73.1,0.6257012111402388,https://leetcode.com/problems/walls-and-gates,"Array, Breadth-First Search, Matrix"
MEDIUM,Longest Palindromic Substring,73.1,0.3529833925453122,https://leetcode.com/problems/longest-palindromic-substring,"Two Pointers, String, Dynamic Programming"
MEDIUM,Course Schedule,73.1,0.4847677696142185,https://leetcode.com/problems/course-schedule,"Depth-First Search, Breadth-First Search, Graph, Topological Sort"
MEDIUM,Count Nodes With the Highest Score,62.0,0.5089312087057909,https://leetcode.com/problems/count-nodes-with-the-highest-score,"Array, Tree, Depth-First Search, Binary Tree"
EASY,Happy Number,62.0,0.5756142726908282,https://leetcode.com/problems/happy-number,"Hash Table, Math, Two Pointers"
EASY,Odd String Difference,62.0,0.606562311860325,https://leetcode.com/problems/odd-string-difference,"Array, Hash Table, String"
HARD,Earliest Possible Day of Full Bloom,62.0,0.7125531521538178,https://leetcode.com/problems/earliest-possible-day-of-full-bloom,"Array, Greedy, Sorting"
MEDIUM,Product of Array Except Self,62.0,0.6738347064393286,https://leetcode.com/problems/product-of-array-except-self,"Array, Prefix Sum"
EASY,Two Furthest Houses With Different Colors,62.0,0.655497686269367,https://leetcode.com/problems/two-furthest-houses-with-different-colors,"Array, Greedy"
MEDIUM,Match Alphanumerical Pattern in Matrix I,62.0,0.6319305277221109,https://leetcode.com/problems/match-alphanumerical-pattern-in-matrix-i,"Array, Hash Table, String, Matrix"
EASY,Divisor Game,62.0,0.6991043403276804,https://leetcode.com/problems/divisor-game,"Math, Dynamic Programming, Brainteaser, Game Theory"
EASY,Valid Parentheses,62.0,0.41845174662669976,https://leetcode.com/problems/valid-parentheses,"String, Stack"
HARD,Shortest Palindrome,62.0,0.4032944607985853,https://leetcode.com/problems/shortest-palindrome,"String, Rolling Hash, String Matching, Hash Function"
HARD,Find Servers That Handled Most Number of Requests,62.0,0.4377124709250313,https://leetcode.com/problems/find-servers-that-handled-most-number-of-requests,"Array, Greedy, Heap (Priority Queue), Ordered Set"
MEDIUM,Largest Number,62.0,0.40860609611684745,https://leetcode.com/problems/largest-number,"Array, String, Greedy, Sorting"
MEDIUM,Minimum Falling Path Sum,62.0,0.6200923746407752,https://leetcode.com/problems/minimum-falling-path-sum,"Array, Dynamic Programming, Matrix"
HARD,Split Message Based on Limit,62.0,0.431437590284094,https://leetcode.com/problems/split-message-based-on-limit,"String, Binary Search, Enumeration"
HARD,Consecutive Numbers Sum,62.0,0.4201061895542487,https://leetcode.com/problems/consecutive-numbers-sum,"Math, Enumeration"
MEDIUM,Add Two Numbers,62.0,0.4543969069729553,https://leetcode.com/problems/add-two-numbers,"Linked List, Math, Recursion"
MEDIUM,Subarray Sum Equals K,62.0,0.44931317696743306,https://leetcode.com/problems/subarray-sum-equals-k,"Array, Hash Table, Prefix Sum"
MEDIUM,Best Time to Buy and Sell Stock with Cooldown,62.0,0.5982892548424776,https://leetcode.com/problems/best-time-to-buy-and-sell-stock-with-cooldown,"Array, Dynamic Programming"
MEDIUM,Minimum Time to Complete Trips,62.0,0.3892450509298253,https://leetcode.com/problems/minimum-time-to-complete-trips,"Array, Binary Search"
MEDIUM,Number of Pairs of Strings With Concatenation Equal to Target,62.0,0.752744030163385,https://leetcode.com/problems/number-of-pairs-of-strings-with-concatenation-equal-to-target,"Array, Hash Table, String, Counting"
MEDIUM,Word Search,62.0,0.4462620297045804,https://leetcode.com/problems/word-search,"Array, String, Backtracking, Depth-First Search, Matrix"
EASY,Plus One,62.0,0.47046357979279035,https://leetcode.com/problems/plus-one,"Array, Math"
MEDIUM,Maximum Subarray,62.0,0.5173371638793948,https://leetcode.com/problems/maximum-subarray,"Array, Divide and Conquer, Dynamic Programming"
MEDIUM,Generate Parentheses,62.0,0.7652986107087103,https://leetcode.com/problems/generate-parentheses,"String, Dynamic Programming, Backtracking"
EASY,Roman to Integer,62.0,0.6415383513370404,https://leetcode.com/problems/roman-to-integer,"Hash Table, Math, String"
HARD,Binary Tree Cameras,62.0,0.47022319456423417,https://leetcode.com/problems/binary-tree-cameras,"Dynamic Programming, Tree, Depth-First Search, Binary Tree"
