Difficulty,Title,Frequency,Acceptance Rate,Link,Topics
MEDIUM,String to Integer (atoi),100.0,0.18717238061706898,https://leetcode.com/problems/string-to-integer-atoi,String
MEDIUM,Brace Expansion,88.6,0.6664295460111253,https://leetcode.com/problems/brace-expansion,"String, Backtracking, Breadth-First Search"
MEDIUM,LRU Cache,88.6,0.4443135316926131,https://leetcode.com/problems/lru-cache,"Hash Table, Linked List, Design, Doubly-Linked List"
MEDIUM,Find the Duplicate Number,88.6,0.6234292620160358,https://leetcode.com/problems/find-the-duplicate-number,"Array, Two Pointers, Binary Search, Bit Manipulation"
MEDIUM,Group Anagrams,88.6,0.7033740183496066,https://leetcode.com/problems/group-anagrams,"Array, Hash Table, String, Sorting"
