Difficulty,Title,Frequency,Acceptance Rate,Link,Topics
EASY,Palindrome Permutation,100.0,0.6807956921206256,https://leetcode.com/problems/palindrome-permutation,"Hash Table, String, Bit Manipulation"
HARD,Integer to English Words,100.0,0.34259617771797646,https://leetcode.com/problems/integer-to-english-words,"Math, String, Recursion"
MEDIUM,House Robber,100.0,0.5198833279508801,https://leetcode.com/problems/house-robber,"Array, Dynamic Programming"
MEDIUM,House Robber II,100.0,0.4312063948215428,https://leetcode.com/problems/house-robber-ii,"Array, Dynamic Programming"
MEDIUM,Spiral Matrix,100.0,0.5293358862301588,https://leetcode.com/problems/spiral-matrix,"Array, Matrix, Simulation"
MEDIUM,Word Break,88.2,0.47875453886493496,https://leetcode.com/problems/word-break,"Array, Hash Table, String, Dynamic Programming, Trie, Memoization"
MEDIUM,LRU Cache,88.2,0.4443133581527686,https://leetcode.com/problems/lru-cache,"Hash Table, Linked List, Design, Doubly-Linked List"
MEDIUM,Meeting Rooms II,88.2,0.5191560514862962,https://leetcode.com/problems/meeting-rooms-ii,"Array, Two Pointers, Greedy, Sorting, Heap (Priority Queue), Prefix Sum"
MEDIUM,Daily Temperatures,88.2,0.6696921215607512,https://leetcode.com/problems/daily-temperatures,"Array, Stack, Monotonic Stack"
