Difficulty,Title,Frequency,Acceptance Rate,Link,Topics
MEDIUM,Partition Labels,100.0,0.8020128092751628,https://leetcode.com/problems/partition-labels,"Hash Table, Two Pointers, String, Greedy"
HARD,Maximum Number of Robots Within Budget,100.0,0.3612835291509643,https://leetcode.com/problems/maximum-number-of-robots-within-budget,"Array, Binary Search, Queue, Sliding Window, Heap (Priority Queue), Prefix Sum, Monotonic Queue"
MEDIUM,Redundant Connection,100.0,0.66074640940542,https://leetcode.com/problems/redundant-connection,"Depth-First Search, Breadth-First Search, Union Find, Graph"
HARD,Longest Valid Parentheses,100.0,0.3569463849830389,https://leetcode.com/problems/longest-valid-parentheses,"String, Dynamic Programming, Stack"
HARD,Trapping Rain Water,100.0,0.6428761327487681,https://leetcode.com/problems/trapping-rain-water,"Array, Two Pointers, Dynamic Programming, Stack, Monotonic Stack"
