Difficulty,Title,Frequency,Acceptance Rate,Link,Topics
HARD,Integer to English Words,100.0,0.3425963980686619,https://leetcode.com/problems/integer-to-english-words,"Math, String, Recursion"
MEDIUM,Number of Accounts That Did Not Stream,96.0,0.722873459573189,https://leetcode.com/problems/number-of-accounts-that-did-not-stream,Database
MEDIUM,Game of Life,88.3,0.7094422174961672,https://leetcode.com/problems/game-of-life,"Array, Matrix, Simulation"
MEDIUM,Product of Array Except Self,88.3,0.6738347396650194,https://leetcode.com/problems/product-of-array-except-self,"Array, Prefix Sum"
HARD,Merge k Sorted Lists,85.0,0.5579591740856451,https://leetcode.com/problems/merge-k-sorted-lists,"Linked List, Divide and Conquer, Heap (Priority Queue), Merge Sort"
EASY,Missing Number,81.0,0.6934743099310112,https://leetcode.com/problems/missing-number,"Array, Hash Table, Math, Binary Search, Bit Manipulation, Sorting"
EASY,Find the Index of the First Occurrence in a String,81.0,0.4446364238132382,https://leetcode.com/problems/find-the-index-of-the-first-occurrence-in-a-string,"Two Pointers, String, String Matching"
MEDIUM,Flatten Nested List Iterator,61.2,0.6516002672377058,https://leetcode.com/problems/flatten-nested-list-iterator,"Stack, Tree, Depth-First Search, Design, Queue, Iterator"
MEDIUM,3Sum,61.2,0.3642336855936599,https://leetcode.com/problems/3sum,"Array, Two Pointers, Sorting"
