Difficulty,Title,Frequency,Acceptance Rate,Link,Topics
EASY,Merge Sorted Array,100.0,0.5225686844080352,https://leetcode.com/problems/merge-sorted-array,"Array, Two Pointers, Sorting"
EASY,Merge Two Sorted Lists,93.7,0.6628957371229809,https://leetcode.com/problems/merge-two-sorted-lists,"Linked List, Recursion"
MEDIUM,Maximum Number of Occurrences of a Substring,87.2,0.5295250065628804,https://leetcode.com/problems/maximum-number-of-occurrences-of-a-substring,"Hash Table, String, Sliding Window"
MEDIUM,Merge Intervals,84.4,0.48806630576703347,https://leetcode.com/problems/merge-intervals,"Array, Sorting"
EASY,Two Sum,81.3,0.5507386430533793,https://leetcode.com/problems/two-sum,"Array, Hash Table"
MEDIUM,Meeting Rooms II,67.1,0.5191549538514568,https://leetcode.com/problems/meeting-rooms-ii,"Array, Two Pointers, Greedy, Sorting, Heap (Priority Queue), Prefix Sum"
MEDIUM,Top K Frequent Elements,58.9,0.6408028798026756,https://leetcode.com/problems/top-k-frequent-elements,"Array, Hash Table, Divide and Conquer, Sorting, Heap (Priority Queue), Bucket Sort, Counting, Quickselect"
HARD,Merge k Sorted Lists,58.9,0.5579543634023972,https://leetcode.com/problems/merge-k-sorted-lists,"Linked List, Divide and Conquer, Heap (Priority Queue), Merge Sort"
HARD,Find the K-Sum of an Array,58.9,0.3955360820881549,https://leetcode.com/problems/find-the-k-sum-of-an-array,"Array, Sorting, Heap (Priority Queue)"
