Difficulty,Title,Frequency,Acceptance Rate,Link,Topics
MEDIUM,Largest Number,100.0,0.40860609611684745,https://leetcode.com/problems/largest-number,"Array, String, Greedy, Sorting"
MEDIUM,Rotting Oranges,89.0,0.5596871680478486,https://leetcode.com/problems/rotting-oranges,"Array, Breadth-First Search, Matrix"
MEDIUM,Fair Distribution of Cookies,89.0,0.6930948473908762,https://leetcode.com/problems/fair-distribution-of-cookies,"Array, Dynamic Programming, Backtracking, Bit Manipulation, Bitmask"
MEDIUM,Number of Islands,89.0,0.6158095716254219,https://leetcode.com/problems/number-of-islands,"Array, Depth-First Search, Breadth-First Search, Union Find, Matrix"
MEDIUM,Merge Intervals,89.0,0.4880655232188065,https://leetcode.com/problems/merge-intervals,"Array, Sorting"
MEDIUM,Daily Temperatures,89.0,0.6696879068677921,https://leetcode.com/problems/daily-temperatures,"Array, Stack, Monotonic Stack"
